{
  "schema": "account-meeting-availability/free-busy-request",
  "schema_version": "1.0",
  "request_id": "no-common-slot",
  "window": {
    "start": "2026-07-15T13:00:00Z",
    "end": "2026-07-15T15:00:00Z"
  },
  "slot_duration_minutes": 30,
  "slot_increment_minutes": 30,
  "max_results": 5,
  "participants": [
    {
      "id": "customer-owner",
      "email": "owner@example.gov",
      "required": true,
      "time_zone": "America/New_York",
      "working_hours": {
        "days": ["monday", "tuesday", "wednesday", "thursday", "friday"],
        "start": "09:00",
        "end": "17:00"
      },
      "busy_intervals": [
        {
          "start": "2026-07-15T09:00:00-04:00",
          "end": "2026-07-15T11:00:00-04:00",
          "status": "out_of_office"
        }
      ]
    },
    {
      "id": "uipath-owner",
      "email": "owner@uipath.com",
      "required": true,
      "time_zone": "UTC",
      "working_hours": {
        "days": ["monday", "tuesday", "wednesday", "thursday", "friday"],
        "start": "09:00",
        "end": "17:00"
      },
      "busy_intervals": []
    }
  ],
  "source": {
    "provider": "outlook",
    "retrieval_mode": "read-only",
    "retrieved_at": "2026-07-10T14:00:00Z"
  }
}
